{
  "schemaVersion": "scaleproof.check-result/v1",
  "checkId": "scaleproof.thresholds",
  "checkVersion": 1,
  "status": "inconclusive",
  "severity": "high",
  "confidence": "low",
  "title": "Synthetic threshold result",
  "summary": "Telemetry is missing; applicability cannot be determined.",
  "evidence": [
    {
      "kind": "metric",
      "ref": "http_req_duration",
      "request": "sample-read",
      "aggregation": "p95",
      "value": 350.5,
      "unit": "ms",
      "sampleCount": 100,
      "count": 0,
      "note": "Synthetic measurement."
    }
  ],
  "limitations": [],
  "recommendations": []
}
