{
  "schemaVersion": "scaleproof.check-result/v1",
  "checkId": "scaleproof.thresholds",
  "checkVersion": 1,
  "status": "not_applicable",
  "severity": "info",
  "confidence": "high",
  "title": "Synthetic threshold result",
  "summary": "An explicit synthetic precondition states this backend has no database.",
  "evidence": [],
  "limitations": [],
  "recommendations": []
}
