{
  "schemaVersion": "scaleproof.check-result/v1",
  "checkId": "scaleproof.thresholds",
  "checkVersion": 1,
  "status": "inconclusive",
  "severity": "high",
  "confidence": "low",
  "title": "Synthetic threshold result",
  "summary": "Telemetry is missing; applicability cannot be determined.",
  "evidence": [],
  "limitations": [
    "Required telemetry was not collected; evidence is unavailable."
  ],
  "recommendations": []
}
